{
  "id": "item_42",
  "referenceId": "item_603",
  "externalReferenceId": "500123",
  "quantity": 1,
  "price": {
    "currency": {},
    "amount": 100
  },
  "menuSelections": [
    {
      "id": {},
      "referenceId": {},
      "externalReferenceId": {},
      "quantity": {},
      "price": {},
      "menuSelections": {}
    }
  ]
}